04:45:49.765344 IP 192.168.0.100.58757 > 202.120.2.2.ftp: Flags [S], seq 3837929012, win 65535, options [mss 1460,nop,wscale 4,nop,nop,TS val 71620437 ecr 0,sackOK,eol], length 0
04:45:50.168960 IP 202.120.2.2.ftp > 192.168.0.100.58757: Flags [S.], seq 308496191, ack 3837929013, win 5792, options [mss 1448,sackOK,TS val 3100691707 ecr 71620437,nop,wscale 7], length 0
04:45:50.169037 IP 192.168.0.100.58757 > 202.120.2.2.ftp: Flags [.], ack 1, win 8257, options [nop,nop,TS val 71620840 ecr 3100691707], length 0
04:45:50.578031 IP 202.120.2.2.ftp > 192.168.0.100.58757: Flags [P.], seq 1:7, ack 1, win 46, options [nop,nop,TS val 3100692121 ecr 71620840], length 6
04:45:50.578115 IP 192.168.0.100.58757 > 202.120.2.2.ftp: Flags [.], ack 7, win 8256, options [nop,nop,TS val 71621249 ecr 3100692121], length 0
04:45:50.987257 IP 202.120.2.2.ftp > 192.168.0.100.58757: Flags [P.], seq 7:418, ack 1, win 46, options [nop,nop,TS val 3100692516 ecr 71621249], length 411
04:45:50.987330 IP 192.168.0.100.58757 > 202.120.2.2.ftp: Flags [.], ack 418, win 8230, options [nop,nop,TS val 71621656 ecr 3100692516], length 0
04:45:50.987636 IP 192.168.0.100.58757 > 202.120.2.2.ftp: Flags [P.], seq 1:19, ack 418, win 8230, options [nop,nop,TS val 71621656 ecr 3100692516], length 18
04:45:51.396462 IP 202.120.2.2.ftp > 192.168.0.100.58757: Flags [.], ack 19, win 46, options [nop,nop,TS val 3100692929 ecr 71621656], length 0
04:45:51.396526 IP 202.120.2.2.ftp > 192.168.0.100.58757: Flags [P.], seq 418:457, ack 19, win 46, options [nop,nop,TS val 3100692931 ecr 71621656], length 39
04:45:51.396594 IP 192.168.0.100.58757 > 202.120.2.2.ftp: Flags [.], ack 457, win 8228, options [nop,nop,TS val 71622063 ecr 3100692931], length 0
04:45:51.396838 IP 192.168.0.100.58757 > 202.120.2.2.ftp: Flags [P.], seq 19:32, ack 457, win 8228, options [nop,nop,TS val 71622063 ecr 3100692931], length 13
04:45:51.805337 IP 202.120.2.2.ftp > 192.168.0.100.58757: Flags [P.], seq 457:495, ack 32, win 46, options [nop,nop,TS val 3100693374 ecr 71622063], length 38
04:45:51.805405 IP 192.168.0.100.58757 > 202.120.2.2.ftp: Flags [.], ack 495, win 8226, options [nop,nop,TS val 71622470 ecr 3100693374], length 0
04:45:52.215464 IP 202.120.2.2.ftp > 192.168.0.100.58757: Flags [P.], seq 495:527, ack 32, win 46, options [nop,nop,TS val 3100693743 ecr 71622470], length 32
04:45:52.215539 IP 192.168.0.100.58757 > 202.120.2.2.ftp: Flags [.], ack 527, win 8224, options [nop,nop,TS val 71622879 ecr 3100693743], length 0
04:45:52.215768 IP 192.168.0.100.58757 > 202.120.2.2.ftp: Flags [P.], seq 32:38, ack 527, win 8224, options [nop,nop,TS val 71622879 ecr 3100693743], length 6
04:45:52.623349 IP 202.120.2.2.ftp > 192.168.0.100.58757: Flags [P.], seq 527:546, ack 38, win 46, options [nop,nop,TS val 3100694157 ecr 71622879], length 19
04:45:52.623440 IP 192.168.0.100.58757 > 202.120.2.2.ftp: Flags [.], ack 546, win 8222, options [nop,nop,TS val 71623285 ecr 3100694157], length 0
04:45:52.623846 IP 192.168.0.100.58757 > 202.120.2.2.ftp: Flags [P.], seq 38:44, ack 546, win 8222, options [nop,nop,TS val 71623285 ecr 3100694157], length 6
04:45:53.032891 IP 202.120.2.2.ftp > 192.168.0.100.58757: Flags [P.], seq 546:581, ack 44, win 46, options [nop,nop,TS val 3100694568 ecr 71623285], length 35
04:45:53.032970 IP 192.168.0.100.58757 > 202.120.2.2.ftp: Flags [.], ack 581, win 8220, options [nop,nop,TS val 71623693 ecr 3100694568], length 0
04:45:53.034375 IP 192.168.0.100.58757 > 202.120.2.2.ftp: Flags [P.], seq 44:49, ack 581, win 8220, options [nop,nop,TS val 71623694 ecr 3100694568], length 5
04:45:53.544362 IP 202.120.2.2.ftp > 192.168.0.100.58757: Flags [P.], seq 581:615, ack 49, win 46, options [nop,nop,TS val 3100694975 ecr 71623694], length 34
04:45:53.544439 IP 192.168.0.100.58757 > 202.120.2.2.ftp: Flags [.], ack 615, win 8218, options [nop,nop,TS val 71624202 ecr 3100694975], length 0
04:45:53.546933 IP 192.168.0.100.58757 > 202.120.2.2.ftp: Flags [P.], seq 49:57, ack 615, win 8218, options [nop,nop,TS val 71624204 ecr 3100694975], length 8
04:45:53.927674 IP 202.120.2.2.ftp > 192.168.0.100.58757: Flags [P.], seq 615:634, ack 57, win 46, options [nop,nop,TS val 3100695485 ecr 71624204], length 19
04:45:53.927752 IP 192.168.0.100.58757 > 202.120.2.2.ftp: Flags [.], ack 634, win 8217, options [nop,nop,TS val 71624584 ecr 3100695485], length 0
04:45:53.928024 IP 192.168.0.100.58757 > 202.120.2.2.ftp: Flags [P.], seq 57:63, ack 634, win 8217, options [nop,nop,TS val 71624584 ecr 3100695485], length 6
04:45:54.260357 IP 202.120.2.2.ftp > 192.168.0.100.58757: Flags [P.], seq 634:684, ack 63, win 46, options [nop,nop,TS val 3100695871 ecr 71624584], length 50
04:45:54.260434 IP 192.168.0.100.58757 > 202.120.2.2.ftp: Flags [.], ack 684, win 8214, options [nop,nop,TS val 71624916 ecr 3100695871], length 0
04:45:54.261429 IP 192.168.0.100.58757 > 202.120.2.2.ftp: Flags [P.], seq 63:69, ack 684, win 8214, options [nop,nop,TS val 71624916 ecr 3100695871], length 6
04:45:54.670031 IP 202.120.2.2.ftp > 192.168.0.100.58757: Flags [.], ack 69, win 46, options [nop,nop,TS val 3100696244 ecr 71624916], length 0
04:45:55.077775 IP 202.120.2.2.ftp > 192.168.0.100.58757: Flags [P.], seq 684:738, ack 69, win 46, options [nop,nop,TS val 3100696608 ecr 71624916], length 54
04:45:55.077848 IP 192.168.0.100.58757 > 202.120.2.2.ftp: Flags [.], ack 738, win 8210, options [nop,nop,TS val 71625730 ecr 3100696608], length 0
04:45:55.487094 IP 202.120.2.2.ftp > 192.168.0.100.58757: Flags [P.], seq 738:761, ack 69, win 46, options [nop,nop,TS val 3100697034 ecr 71625730], length 23
04:45:55.487207 IP 192.168.0.100.58757 > 202.120.2.2.ftp: Flags [.], ack 761, win 8209, options [nop,nop,TS val 71626136 ecr 3100697034], length 0
04:46:13.843817 IP 192.168.0.100.58759 > 202.120.2.2.ftp: Flags [S], seq 679660869, win 65535, options [mss 1460,nop,wscale 4,nop,nop,TS val 71644480 ecr 0,sackOK,eol], length 0
04:46:14.203272 IP 202.120.2.2.ftp > 192.168.0.100.58759: Flags [S.], seq 332086014, ack 679660870, win 5792, options [mss 1448,sackOK,TS val 3100715791 ecr 71644480,nop,wscale 7], length 0
04:46:14.203344 IP 192.168.0.100.58759 > 202.120.2.2.ftp: Flags [.], ack 1, win 8257, options [nop,nop,TS val 71644839 ecr 3100715791], length 0
04:46:14.612298 IP 202.120.2.2.ftp > 192.168.0.100.58759: Flags [P.], seq 1:7, ack 1, win 46, options [nop,nop,TS val 3100716167 ecr 71644839], length 6
04:46:14.612383 IP 192.168.0.100.58759 > 202.120.2.2.ftp: Flags [.], ack 7, win 8256, options [nop,nop,TS val 71645247 ecr 3100716167], length 0
04:46:15.021501 IP 202.120.2.2.ftp > 192.168.0.100.58759: Flags [P.], seq 7:418, ack 1, win 46, options [nop,nop,TS val 3100716566 ecr 71645247], length 411
04:46:15.021571 IP 192.168.0.100.58759 > 202.120.2.2.ftp: Flags [.], ack 418, win 8230, options [nop,nop,TS val 71645655 ecr 3100716566], length 0
04:46:15.021969 IP 192.168.0.100.58759 > 202.120.2.2.ftp: Flags [P.], seq 1:19, ack 418, win 8230, options [nop,nop,TS val 71645655 ecr 3100716566], length 18
04:46:15.430623 IP 202.120.2.2.ftp > 192.168.0.100.58759: Flags [.], ack 19, win 46, options [nop,nop,TS val 3100716969 ecr 71645655], length 0
04:46:15.430739 IP 202.120.2.2.ftp > 192.168.0.100.58759: Flags [P.], seq 418:457, ack 19, win 46, options [nop,nop,TS val 3100716972 ecr 71645655], length 39
04:46:15.430793 IP 192.168.0.100.58759 > 202.120.2.2.ftp: Flags [.], ack 457, win 8228, options [nop,nop,TS val 71646061 ecr 3100716972], length 0
04:46:15.431055 IP 192.168.0.100.58759 > 202.120.2.2.ftp: Flags [P.], seq 19:32, ack 457, win 8228, options [nop,nop,TS val 71646061 ecr 3100716972], length 13
04:46:15.839536 IP 202.120.2.2.ftp > 192.168.0.100.58759: Flags [P.], seq 457:495, ack 32, win 46, options [nop,nop,TS val 3100717402 ecr 71646061], length 38
04:46:15.839615 IP 192.168.0.100.58759 > 202.120.2.2.ftp: Flags [.], ack 495, win 8226, options [nop,nop,TS val 71646468 ecr 3100717402], length 0
04:46:16.248553 IP 202.120.2.2.ftp > 192.168.0.100.58759: Flags [P.], seq 495:527, ack 32, win 46, options [nop,nop,TS val 3100717783 ecr 71646468], length 32
04:46:16.248632 IP 192.168.0.100.58759 > 202.120.2.2.ftp: Flags [.], ack 527, win 8224, options [nop,nop,TS val 71646876 ecr 3100717783], length 0
04:46:16.249838 IP 192.168.0.100.58759 > 202.120.2.2.ftp: Flags [P.], seq 32:39, ack 527, win 8224, options [nop,nop,TS val 71646877 ecr 3100717783], length 7
04:46:16.657879 IP 202.120.2.2.ftp > 192.168.0.100.58759: Flags [P.], seq 527:555, ack 39, win 46, options [nop,nop,TS val 3100718200 ecr 71646877], length 28
04:46:16.657962 IP 192.168.0.100.58759 > 202.120.2.2.ftp: Flags [.], ack 555, win 8222, options [nop,nop,TS val 71647283 ecr 3100718200], length 0
04:46:16.658167 IP 192.168.0.100.58759 > 202.120.2.2.ftp: Flags [P.], seq 39:44, ack 555, win 8222, options [nop,nop,TS val 71647283 ecr 3100718200], length 5
04:46:17.066988 IP 202.120.2.2.ftp > 192.168.0.100.58759: Flags [P.], seq 555:589, ack 44, win 46, options [nop,nop,TS val 3100718608 ecr 71647283], length 34
04:46:17.067067 IP 192.168.0.100.58759 > 202.120.2.2.ftp: Flags [.], ack 589, win 8220, options [nop,nop,TS val 71647691 ecr 3100718608], length 0
04:46:17.067954 IP 192.168.0.100.58759 > 202.120.2.2.ftp: Flags [P.], seq 44:52, ack 589, win 8220, options [nop,nop,TS val 71647691 ecr 3100718608], length 8
04:46:17.476357 IP 202.120.2.2.ftp > 192.168.0.100.58759: Flags [P.], seq 589:608, ack 52, win 46, options [nop,nop,TS val 3100719017 ecr 71647691], length 19
04:46:17.476451 IP 192.168.0.100.58759 > 202.120.2.2.ftp: Flags [.], ack 608, win 8219, options [nop,nop,TS val 71648098 ecr 3100719017], length 0
04:46:17.477892 IP 192.168.0.100.58759 > 202.120.2.2.ftp: Flags [P.], seq 52:58, ack 608, win 8219, options [nop,nop,TS val 71648099 ecr 3100719017], length 6
04:46:17.885229 IP 202.120.2.2.ftp > 192.168.0.100.58759: Flags [P.], seq 608:658, ack 58, win 46, options [nop,nop,TS val 3100719425 ecr 71648099], length 50
04:46:17.885304 IP 192.168.0.100.58759 > 202.120.2.2.ftp: Flags [.], ack 658, win 8215, options [nop,nop,TS val 71648505 ecr 3100719425], length 0
04:46:17.886113 IP 192.168.0.100.58759 > 202.120.2.2.ftp: Flags [P.], seq 58:75, ack 658, win 8215, options [nop,nop,TS val 71648505 ecr 3100719425], length 17
04:46:18.294605 IP 202.120.2.2.ftp > 192.168.0.100.58759: Flags [.], ack 75, win 46, options [nop,nop,TS val 3100719871 ecr 71648505], length 0
04:46:18.703170 IP 202.120.2.2.ftp > 192.168.0.100.58759: Flags [P.], seq 658:727, ack 75, win 46, options [nop,nop,TS val 3100720233 ecr 71648505], length 69
04:46:18.703244 IP 192.168.0.100.58759 > 202.120.2.2.ftp: Flags [.], ack 727, win 8211, options [nop,nop,TS val 71649320 ecr 3100720233], length 0
04:46:19.188619 IP 202.120.2.2.ftp > 192.168.0.100.58759: Flags [P.], seq 727:750, ack 75, win 46, options [nop,nop,TS val 3100720828 ecr 71649320], length 23
04:46:19.188748 IP 192.168.0.100.58759 > 202.120.2.2.ftp: Flags [.], ack 750, win 8210, options [nop,nop,TS val 71649802 ecr 3100720828], length 0
04:46:24.693479 IP 192.168.0.100.58757 > 202.120.2.2.ftp: Flags [P.], seq 69:81, ack 761, win 8209, options [nop,nop,TS val 71655299 ecr 3100697034], length 12
04:46:25.044321 IP 202.120.2.2.ftp > 192.168.0.100.58757: Flags [.], ack 81, win 46, options [nop,nop,TS val 3100726642 ecr 71655299], length 0
04:46:25.044422 IP 202.120.2.2.ftp > 192.168.0.100.58757: Flags [P.], seq 761:789, ack 81, win 46, options [nop,nop,TS val 3100726644 ecr 71655299], length 28
04:46:25.044479 IP 192.168.0.100.58757 > 202.120.2.2.ftp: Flags [.], ack 789, win 8207, options [nop,nop,TS val 71655648 ecr 3100726644], length 0
04:46:25.044727 IP 192.168.0.100.58757 > 202.120.2.2.ftp: Flags [P.], seq 81:86, ack 789, win 8207, options [nop,nop,TS val 71655648 ecr 3100726644], length 5
04:46:25.453322 IP 202.120.2.2.ftp > 192.168.0.100.58757: Flags [P.], seq 789:829, ack 86, win 46, options [nop,nop,TS val 3100726991 ecr 71655648], length 40
04:46:25.453386 IP 192.168.0.100.58757 > 202.120.2.2.ftp: Flags [.], ack 829, win 8205, options [nop,nop,TS val 71656056 ecr 3100726991], length 0
04:46:25.453647 IP 192.168.0.100.58757 > 202.120.2.2.ftp: Flags [P.], seq 86:92, ack 829, win 8205, options [nop,nop,TS val 71656056 ecr 3100726991], length 6
04:46:25.862500 IP 202.120.2.2.ftp > 192.168.0.100.58757: Flags [P.], seq 829:879, ack 92, win 46, options [nop,nop,TS val 3100727399 ecr 71656056], length 50
04:46:25.862591 IP 192.168.0.100.58757 > 202.120.2.2.ftp: Flags [.], ack 879, win 8202, options [nop,nop,TS val 71656464 ecr 3100727399], length 0
04:46:25.864439 IP 192.168.0.100.58757 > 202.120.2.2.ftp: Flags [P.], seq 92:98, ack 879, win 8202, options [nop,nop,TS val 71656465 ecr 3100727399], length 6
04:46:26.271773 IP 202.120.2.2.ftp > 192.168.0.100.58757: Flags [.], ack 98, win 46, options [nop,nop,TS val 3100727848 ecr 71656465], length 0
04:46:26.683343 IP 202.120.2.2.ftp > 192.168.0.100.58757: Flags [P.], seq 879:933, ack 98, win 46, options [nop,nop,TS val 3100728214 ecr 71656465], length 54
04:46:26.683471 IP 192.168.0.100.58757 > 202.120.2.2.ftp: Flags [.], ack 933, win 8198, options [nop,nop,TS val 71657280 ecr 3100728214], length 0
04:46:27.090131 IP 202.120.2.2.ftp > 192.168.0.100.58757: Flags [P.], seq 933:956, ack 98, win 46, options [nop,nop,TS val 3100728629 ecr 71657280], length 23
04:46:27.090193 IP 192.168.0.100.58757 > 202.120.2.2.ftp: Flags [.], ack 956, win 8197, options [nop,nop,TS val 71657686 ecr 3100728629], length 0
04:46:31.350352 IP 192.168.0.100.58759 > 202.120.2.2.ftp: Flags [P.], seq 75:88, ack 750, win 8210, options [nop,nop,TS val 71661944 ecr 3100720828], length 13
04:46:31.351188 IP 192.168.0.100.58762 > 202.120.2.2.ftp: Flags [S], seq 2119708603, win 65535, options [mss 1460,nop,wscale 4,nop,nop,TS val 71661944 ecr 0,sackOK,eol], length 0
04:46:31.692021 IP 202.120.2.2.ftp > 192.168.0.100.58759: Flags [.], ack 88, win 46, options [nop,nop,TS val 3100733294 ecr 71661944], length 0
04:46:31.692147 IP 202.120.2.2.ftp > 192.168.0.100.58759: Flags [P.], seq 750:778, ack 88, win 46, options [nop,nop,TS val 3100733296 ecr 71661944], length 28
04:46:31.692151 IP 202.120.2.2.ftp > 192.168.0.100.58762: Flags [S.], seq 352023725, ack 2119708604, win 5792, options [mss 1448,sackOK,TS val 3100733298 ecr 71661944,nop,wscale 7], length 0
04:46:31.692216 IP 192.168.0.100.58759 > 202.120.2.2.ftp: Flags [.], ack 778, win 8208, options [nop,nop,TS val 71662285 ecr 3100733296], length 0
04:46:31.692261 IP 192.168.0.100.58762 > 202.120.2.2.ftp: Flags [.], ack 1, win 8257, options [nop,nop,TS val 71662285 ecr 3100733298], length 0
04:46:31.692433 IP 192.168.0.100.58759 > 202.120.2.2.ftp: Flags [P.], seq 88:93, ack 778, win 8208, options [nop,nop,TS val 71662285 ecr 3100733296], length 5
04:46:32.101221 IP 202.120.2.2.ftp > 192.168.0.100.58759: Flags [P.], seq 778:818, ack 93, win 46, options [nop,nop,TS val 3100733641 ecr 71662285], length 40
04:46:32.101284 IP 202.120.2.2.ftp > 192.168.0.100.58762: Flags [P.], seq 1:7, ack 1, win 46, options [nop,nop,TS val 3100733652 ecr 71662285], length 6
04:46:32.101337 IP 192.168.0.100.58759 > 202.120.2.2.ftp: Flags [.], ack 818, win 8205, options [nop,nop,TS val 71662693 ecr 3100733641], length 0
04:46:32.101385 IP 192.168.0.100.58762 > 202.120.2.2.ftp: Flags [.], ack 7, win 8256, options [nop,nop,TS val 71662693 ecr 3100733652], length 0
04:46:32.101927 IP 192.168.0.100.58759 > 202.120.2.2.ftp: Flags [P.], seq 93:101, ack 818, win 8205, options [nop,nop,TS val 71662693 ecr 3100733641], length 8
04:46:32.406322 IP 202.120.2.2.ftp > 192.168.0.100.58759: Flags [P.], seq 818:837, ack 101, win 46, options [nop,nop,TS val 3100734048 ecr 71662693], length 19
04:46:32.406404 IP 192.168.0.100.58759 > 202.120.2.2.ftp: Flags [.], ack 837, win 8204, options [nop,nop,TS val 71662997 ecr 3100734048], length 0
04:46:32.406523 IP 202.120.2.2.ftp > 192.168.0.100.58762: Flags [P.], seq 7:418, ack 1, win 46, options [nop,nop,TS val 3100734048 ecr 71662693], length 411
04:46:32.406611 IP 192.168.0.100.58762 > 202.120.2.2.ftp: Flags [.], ack 418, win 8230, options [nop,nop,TS val 71662997 ecr 3100734048], length 0
04:46:32.406830 IP 192.168.0.100.58759 > 202.120.2.2.ftp: Flags [P.], seq 101:107, ack 837, win 8204, options [nop,nop,TS val 71662997 ecr 3100734048], length 6
04:46:32.406895 IP 192.168.0.100.58762 > 202.120.2.2.ftp: Flags [P.], seq 1:19, ack 418, win 8230, options [nop,nop,TS val 71662997 ecr 3100734048], length 18
04:46:32.816987 IP 202.120.2.2.ftp > 192.168.0.100.58762: Flags [.], ack 19, win 46, options [nop,nop,TS val 3100734352 ecr 71662997], length 0
04:46:32.817580 IP 202.120.2.2.ftp > 192.168.0.100.58762: Flags [P.], seq 418:457, ack 19, win 46, options [nop,nop,TS val 3100734354 ecr 71662997], length 39
04:46:32.817649 IP 192.168.0.100.58762 > 202.120.2.2.ftp: Flags [.], ack 457, win 8228, options [nop,nop,TS val 71663406 ecr 3100734354], length 0
04:46:32.817761 IP 202.120.2.2.ftp > 192.168.0.100.58759: Flags [P.], seq 837:887, ack 107, win 46, options [nop,nop,TS val 3100734354 ecr 71662997], length 50
04:46:32.817846 IP 192.168.0.100.58759 > 202.120.2.2.ftp: Flags [.], ack 887, win 8201, options [nop,nop,TS val 71663406 ecr 3100734354], length 0
04:46:32.817865 IP 192.168.0.100.58762 > 202.120.2.2.ftp: Flags [P.], seq 19:32, ack 457, win 8228, options [nop,nop,TS val 71663406 ecr 3100734354], length 13
04:46:32.818798 IP 192.168.0.100.58759 > 202.120.2.2.ftp: Flags [P.], seq 107:122, ack 887, win 8201, options [nop,nop,TS val 71663407 ecr 3100734354], length 15
04:46:33.226762 IP 202.120.2.2.ftp > 192.168.0.100.58762: Flags [P.], seq 457:495, ack 32, win 46, options [nop,nop,TS val 3100734786 ecr 71663406], length 38
04:46:33.226764 IP 202.120.2.2.ftp > 192.168.0.100.58759: Flags [.], ack 122, win 46, options [nop,nop,TS val 3100734805 ecr 71663407], length 0
04:46:33.226806 IP 192.168.0.100.58762 > 202.120.2.2.ftp: Flags [.], ack 495, win 8226, options [nop,nop,TS val 71663813 ecr 3100734786], length 0
04:46:33.635392 IP 202.120.2.2.ftp > 192.168.0.100.58759: Flags [P.], seq 887:953, ack 122, win 46, options [nop,nop,TS val 3100735169 ecr 71663407], length 66
04:46:33.635522 IP 202.120.2.2.ftp > 192.168.0.100.58762: Flags [P.], seq 495:527, ack 32, win 46, options [nop,nop,TS val 3100735172 ecr 71663813], length 32
04:46:33.635541 IP 192.168.0.100.58759 > 202.120.2.2.ftp: Flags [.], ack 953, win 8197, options [nop,nop,TS val 71664221 ecr 3100735169], length 0
04:46:33.635610 IP 192.168.0.100.58762 > 202.120.2.2.ftp: Flags [.], ack 527, win 8224, options [nop,nop,TS val 71664221 ecr 3100735172], length 0
04:46:33.636978 IP 192.168.0.100.58762 > 202.120.2.2.ftp: Flags [P.], seq 32:45, ack 527, win 8224, options [nop,nop,TS val 71664222 ecr 3100735172], length 13
04:46:34.044268 IP 202.120.2.2.ftp > 192.168.0.100.58762: Flags [P.], seq 527:555, ack 45, win 46, options [nop,nop,TS val 3100735585 ecr 71664222], length 28
04:46:34.044384 IP 192.168.0.100.58762 > 202.120.2.2.ftp: Flags [.], ack 555, win 8222, options [nop,nop,TS val 71664628 ecr 3100735585], length 0
04:46:34.045065 IP 192.168.0.100.58762 > 202.120.2.2.ftp: Flags [P.], seq 45:53, ack 555, win 8222, options [nop,nop,TS val 71664628 ecr 3100735585], length 8
04:46:34.053021 IP 202.120.2.2.ftp > 192.168.0.100.58759: Flags [P.], seq 953:976, ack 122, win 46, options [nop,nop,TS val 3100735695 ecr 71664221], length 23
04:46:34.053117 IP 192.168.0.100.58759 > 202.120.2.2.ftp: Flags [.], ack 976, win 8196, options [nop,nop,TS val 71664636 ecr 3100735695], length 0
04:46:34.453134 IP 202.120.2.2.ftp > 192.168.0.100.58762: Flags [P.], seq 555:574, ack 53, win 46, options [nop,nop,TS val 3100735992 ecr 71664628], length 19
04:46:34.453218 IP 192.168.0.100.58762 > 202.120.2.2.ftp: Flags [.], ack 574, win 8221, options [nop,nop,TS val 71665036 ecr 3100735992], length 0
04:46:34.453335 IP 192.168.0.100.58762 > 202.120.2.2.ftp: Flags [P.], seq 53:59, ack 574, win 8221, options [nop,nop,TS val 71665036 ecr 3100735992], length 6
04:46:34.862368 IP 202.120.2.2.ftp > 192.168.0.100.58762: Flags [P.], seq 574:624, ack 59, win 46, options [nop,nop,TS val 3100736401 ecr 71665036], length 50
04:46:34.862449 IP 192.168.0.100.58762 > 202.120.2.2.ftp: Flags [.], ack 624, win 8218, options [nop,nop,TS val 71665444 ecr 3100736401], length 0
04:46:34.864297 IP 192.168.0.100.58762 > 202.120.2.2.ftp: Flags [P.], seq 59:79, ack 624, win 8218, options [nop,nop,TS val 71665445 ecr 3100736401], length 20
04:46:35.272859 IP 202.120.2.2.ftp > 192.168.0.100.58762: Flags [.], ack 79, win 46, options [nop,nop,TS val 3100736849 ecr 71665445], length 0
04:46:35.680912 IP 202.120.2.2.ftp > 192.168.0.100.58762: Flags [P.], seq 624:695, ack 79, win 46, options [nop,nop,TS val 3100737215 ecr 71665445], length 71
04:46:35.680986 IP 192.168.0.100.58762 > 202.120.2.2.ftp: Flags [.], ack 695, win 8213, options [nop,nop,TS val 71666261 ecr 3100737215], length 0
04:46:36.108728 IP 202.120.2.2.ftp > 192.168.0.100.58762: Flags [P.], seq 695:718, ack 79, win 46, options [nop,nop,TS val 3100737751 ecr 71666261], length 23
04:46:36.108801 IP 192.168.0.100.58762 > 202.120.2.2.ftp: Flags [.], ack 718, win 8212, options [nop,nop,TS val 71666685 ecr 3100737751], length 0
04:46:37.617048 IP 192.168.0.100.58757 > 202.120.2.2.ftp: Flags [P.], seq 98:104, ack 956, win 8197, options [nop,nop,TS val 71668188 ecr 3100728629], length 6
04:46:38.032891 IP 202.120.2.2.ftp > 192.168.0.100.58757: Flags [.], ack 104, win 46, options [nop,nop,TS val 3100739561 ecr 71668188], length 0
04:46:38.033325 IP 202.120.2.2.ftp > 192.168.0.100.58757: Flags [P.], seq 956:985, ack 104, win 46, options [nop,nop,TS val 3100739561 ecr 71668188], length 29
04:46:38.033396 IP 192.168.0.100.58757 > 202.120.2.2.ftp: Flags [.], ack 985, win 8195, options [nop,nop,TS val 71668603 ecr 3100739561], length 0
04:46:38.033694 IP 192.168.0.100.58757 > 202.120.2.2.ftp: Flags [P.], seq 104:109, ack 985, win 8195, options [nop,nop,TS val 71668603 ecr 3100739561], length 5
04:46:38.442961 IP 202.120.2.2.ftp > 192.168.0.100.58757: Flags [P.], seq 985:1019, ack 109, win 46, options [nop,nop,TS val 3100739978 ecr 71668603], length 34
04:46:38.443041 IP 192.168.0.100.58757 > 202.120.2.2.ftp: Flags [.], ack 1019, win 8193, options [nop,nop,TS val 71669012 ecr 3100739978], length 0
04:46:40.314852 IP 192.168.0.100.58757 > 202.120.2.2.ftp: Flags [P.], seq 109:120, ack 1019, win 8193, options [nop,nop,TS val 71670883 ecr 3100739978], length 11
04:46:40.692663 IP 202.120.2.2.ftp > 192.168.0.100.58757: Flags [.], ack 120, win 46, options [nop,nop,TS val 3100742301 ecr 71670883], length 0
04:46:42.533139 IP 202.120.2.2.ftp > 192.168.0.100.58757: Flags [P.], seq 1019:1047, ack 120, win 46, options [nop,nop,TS val 3100744130 ecr 71670883], length 28
04:46:42.533212 IP 192.168.0.100.58757 > 202.120.2.2.ftp: Flags [.], ack 1047, win 8191, options [nop,nop,TS val 71673097 ecr 3100744130], length 0
04:46:42.533454 IP 192.168.0.100.58757 > 202.120.2.2.ftp: Flags [P.], seq 120:125, ack 1047, win 8192, options [nop,nop,TS val 71673097 ecr 3100744130], length 5
04:46:42.942375 IP 202.120.2.2.ftp > 192.168.0.100.58757: Flags [.], ack 125, win 46, options [nop,nop,TS val 3100744481 ecr 71673097], length 0
04:46:42.942458 IP 202.120.2.2.ftp > 192.168.0.100.58757: Flags [P.], seq 1047:1086, ack 125, win 46, options [nop,nop,TS val 3100744481 ecr 71673097], length 39
04:46:42.942573 IP 192.168.0.100.58757 > 202.120.2.2.ftp: Flags [.], ack 1086, win 8189, options [nop,nop,TS val 71673505 ecr 3100744481], length 0
04:46:42.942869 IP 192.168.0.100.58757 > 202.120.2.2.ftp: Flags [P.], seq 125:131, ack 1086, win 8192, options [nop,nop,TS val 71673505 ecr 3100744481], length 6
04:46:43.351658 IP 202.120.2.2.ftp > 192.168.0.100.58757: Flags [P.], seq 1086:1135, ack 131, win 46, options [nop,nop,TS val 3100744897 ecr 71673505], length 49
04:46:43.351736 IP 192.168.0.100.58757 > 202.120.2.2.ftp: Flags [.], ack 1135, win 8188, options [nop,nop,TS val 71673913 ecr 3100744897], length 0
04:46:43.352891 IP 192.168.0.100.58757 > 202.120.2.2.ftp: Flags [P.], seq 131:137, ack 1135, win 8192, options [nop,nop,TS val 71673914 ecr 3100744897], length 6
04:46:43.760725 IP 202.120.2.2.ftp > 192.168.0.100.58757: Flags [.], ack 137, win 46, options [nop,nop,TS val 3100745342 ecr 71673914], length 0
04:46:44.169417 IP 202.120.2.2.ftp > 192.168.0.100.58757: Flags [P.], seq 1135:1189, ack 137, win 46, options [nop,nop,TS val 3100745706 ecr 71673914], length 54
04:46:44.169490 IP 192.168.0.100.58757 > 202.120.2.2.ftp: Flags [.], ack 1189, win 8188, options [nop,nop,TS val 71674728 ecr 3100745706], length 0
04:46:45.499161 IP 202.120.2.2.ftp > 192.168.0.100.58757: Flags [P.], seq 1189:1212, ack 137, win 46, options [nop,nop,TS val 3100747040 ecr 71674728], length 23
04:46:45.499220 IP 192.168.0.100.58757 > 202.120.2.2.ftp: Flags [.], ack 1212, win 8190, options [nop,nop,TS val 71676055 ecr 3100747040], length 0
04:46:51.044698 IP 192.168.0.100.58759 > 202.120.2.2.ftp: Flags [P.], seq 122:134, ack 976, win 8196, options [nop,nop,TS val 71681595 ecr 3100735695], length 12
04:46:51.431300 IP 202.120.2.2.ftp > 192.168.0.100.58759: Flags [.], ack 134, win 46, options [nop,nop,TS val 3100752992 ecr 71681595], length 0
04:46:51.431545 IP 202.120.2.2.ftp > 192.168.0.100.58759: Flags [P.], seq 976:1004, ack 134, win 46, options [nop,nop,TS val 3100752994 ecr 71681595], length 28
04:46:51.431612 IP 192.168.0.100.58759 > 202.120.2.2.ftp: Flags [.], ack 1004, win 8194, options [nop,nop,TS val 71681979 ecr 3100752994], length 0
04:46:51.431834 IP 192.168.0.100.58759 > 202.120.2.2.ftp: Flags [P.], seq 134:139, ack 1004, win 8194, options [nop,nop,TS val 71681979 ecr 3100752994], length 5
04:46:51.839980 IP 202.120.2.2.ftp > 192.168.0.100.58759: Flags [P.], seq 1004:1043, ack 139, win 46, options [nop,nop,TS val 3100753379 ecr 71681979], length 39
04:46:51.840075 IP 192.168.0.100.58759 > 202.120.2.2.ftp: Flags [.], ack 1043, win 8191, options [nop,nop,TS val 71682386 ecr 3100753379], length 0
04:46:51.840754 IP 192.168.0.100.58759 > 202.120.2.2.ftp: Flags [P.], seq 139:145, ack 1043, win 8192, options [nop,nop,TS val 71682386 ecr 3100753379], length 6
04:46:52.249478 IP 202.120.2.2.ftp > 192.168.0.100.58759: Flags [P.], seq 1043:1093, ack 145, win 46, options [nop,nop,TS val 3100753790 ecr 71682386], length 50
04:46:52.249626 IP 192.168.0.100.58759 > 202.120.2.2.ftp: Flags [.], ack 1093, win 8188, options [nop,nop,TS val 71682795 ecr 3100753790], length 0
04:46:52.250556 IP 192.168.0.100.58759 > 202.120.2.2.ftp: Flags [P.], seq 145:163, ack 1093, win 8192, options [nop,nop,TS val 71682795 ecr 3100753790], length 18
04:46:52.658829 IP 202.120.2.2.ftp > 192.168.0.100.58759: Flags [.], ack 163, win 46, options [nop,nop,TS val 3100754238 ecr 71682795], length 0
04:46:53.065333 IP 202.120.2.2.ftp > 192.168.0.100.58759: Flags [P.], seq 1093:1162, ack 163, win 46, options [nop,nop,TS val 3100754603 ecr 71682795], length 69
04:46:53.065406 IP 192.168.0.100.58759 > 202.120.2.2.ftp: Flags [.], ack 1162, win 8187, options [nop,nop,TS val 71683609 ecr 3100754603], length 0
04:46:53.487120 IP 202.120.2.2.ftp > 192.168.0.100.58759: Flags [P.], seq 1162:1185, ack 163, win 46, options [nop,nop,TS val 3100755130 ecr 71683609], length 23
04:46:53.487248 IP 192.168.0.100.58759 > 202.120.2.2.ftp: Flags [.], ack 1185, win 8190, options [nop,nop,TS val 71684028 ecr 3100755130], length 0
04:47:09.052783 IP 192.168.0.100.58757 > 202.120.2.2.ftp: Flags [F.], seq 137, ack 1212, win 8192, options [nop,nop,TS val 71699588 ecr 3100747040], length 0
04:47:09.431160 IP 202.120.2.2.ftp > 192.168.0.100.58757: Flags [F.], seq 1212, ack 138, win 46, options [nop,nop,TS val 3100771003 ecr 71699588], length 0
04:47:09.431240 IP 192.168.0.100.58757 > 202.120.2.2.ftp: Flags [.], ack 1213, win 8192, options [nop,nop,TS val 71699966 ecr 3100771003], length 0
04:47:14.335985 IP 192.168.0.100.58759 > 202.120.2.2.ftp: Flags [F.], seq 163, ack 1185, win 8192, options [nop,nop,TS val 71704864 ecr 3100755130], length 0
04:47:14.336330 IP 192.168.0.100.58762 > 202.120.2.2.ftp: Flags [F.], seq 79, ack 718, win 8212, options [nop,nop,TS val 71704864 ecr 3100737751], length 0
04:47:14.749614 IP 202.120.2.2.ftp > 192.168.0.100.58759: Flags [F.], seq 1185, ack 164, win 46, options [nop,nop,TS val 3100776289 ecr 71704864], length 0
04:47:14.749678 IP 192.168.0.100.58759 > 202.120.2.2.ftp: Flags [.], ack 1186, win 8192, options [nop,nop,TS val 71705275 ecr 3100776289], length 0
04:47:14.749763 IP 202.120.2.2.ftp > 192.168.0.100.58762: Flags [F.], seq 718, ack 80, win 46, options [nop,nop,TS val 3100776292 ecr 71704864], length 0
04:47:14.749807 IP 192.168.0.100.58762 > 202.120.2.2.ftp: Flags [.], ack 719, win 8212, options [nop,nop,TS val 71705275 ecr 3100776292], length 0
